link_URL,adjective_score,important_phrase,Date,District,Category,color
https://www.minneapolisfed.org/news-and-events/beige-book-archive/2013-06-at,-0.1,"Since our last report, monthly prices paid to farmers for beef, broilers, corn for grain, and soybeans decreased while cotton prices increased slightly",201306,Atlanta,"Agriculture, Energy, Natural Resources",#D3D3D3
https://www.minneapolisfed.org/news-and-events/beige-book-archive/2013-06-at,1.0,"On balance, Sixth District business conditions improved modestly in April and May",201306,Atlanta,Economy,#92c5de
https://www.minneapolisfed.org/news-and-events/beige-book-archive/2013-06-at,0.7272727272727273,Most firms continued to experience fairly stable input costs,201306,Atlanta,"Employment, Prices, Wages",#92c5de
https://www.minneapolisfed.org/news-and-events/beige-book-archive/2013-06-at,0.25,"Overall demand for new loans remained weak as banks faced significant pressure to improve net interest margins and increased competition from non-bank providers of capital, such as private equity groups",201306,Atlanta,Finance,#D3D3D3
https://www.minneapolisfed.org/news-and-events/beige-book-archive/2013-06-at,0.2857142857142857,"District railway contacts reported increased intermodal traffic; however, total volume was flat to slightly down compared with a year ago",201306,Atlanta,"Manufacturing, Services",#D3D3D3
https://www.minneapolisfed.org/news-and-events/beige-book-archive/2013-06-at,1.25,Construction activity rose modestly again,201306,Atlanta,"Real Estate, Construction",#0571b0
https://www.minneapolisfed.org/news-and-events/beige-book-archive/2013-06-at,0.9166666666666666,District retail contacts noted an improvement in consumer spending but were cautiously optimistic regarding their outlook,201306,Atlanta,"Retail, Consumer Spending",#92c5de
https://www.minneapolisfed.org/news-and-events/beige-book-archive/2013-06-bo,1.0,"First District business contacts generally report year-over-year increases in economic activity, although some--notably in software and information technology services and staffing--indicate the pace of growth is slowing",201306,Boston,Economy,#92c5de
https://www.minneapolisfed.org/news-and-events/beige-book-archive/2013-06-bo,0.25,"Nevertheless, bill rates and pay rates have gone largely unchanged in 2013",201306,Boston,"Employment, Prices, Wages",#D3D3D3
https://www.minneapolisfed.org/news-and-events/beige-book-archive/2013-06-bo,0.28,"Looking forward, software and IT firms in New England remain cautiously optimistic, with most expecting more robust growth in the second half of 2013",201306,Boston,"Manufacturing, Services",#D3D3D3
https://www.minneapolisfed.org/news-and-events/beige-book-archive/2013-06-bo,0.6666666666666666,Business confidence in southern Maine reportedly improved but no major expansions or hiring plans were announced,201306,Boston,"Real Estate, Construction",#92c5de
https://www.minneapolisfed.org/news-and-events/beige-book-archive/2013-06-bo,0.25,Contacts continue to predict low-single digit sales increases for 2013,201306,Boston,"Retail, Consumer Spending",#D3D3D3
https://www.minneapolisfed.org/news-and-events/beige-book-archive/2013-06-ch,-0.75,"However, price declines were anticipated for the new crop in the fall, as concerns over major yield losses abated",201306,Chicago,"Agriculture, Energy, Natural Resources",#f4a582
https://www.minneapolisfed.org/news-and-events/beige-book-archive/2013-06-ch,0.6428571428571429,"Growth in consumer spending increased slightly, while growth in business spending slowed",201306,Chicago,Economy,#92c5de
https://www.minneapolisfed.org/news-and-events/beige-book-archive/2013-06-ch,0.5,"Wge pressures were again moderate, although many contacts noted rising healthcare costs and uncertainty about future employee healthcare obligations associated with the Affordable Care Act",201306,Chicago,"Employment, Prices, Wages",#92c5de
https://www.minneapolisfed.org/news-and-events/beige-book-archive/2013-06-ch,0.2222222222222222,"Mortgage refinance activity, while still strong, began to slow, but contacts noted a slight increase in purchase applications",201306,Chicago,Finance,#D3D3D3
https://www.minneapolisfed.org/news-and-events/beige-book-archive/2013-06-ch,-0.05,Labor market conditions continued to improve slowly,201306,Chicago,"Manufacturing, Services",#D3D3D3
https://www.minneapolisfed.org/news-and-events/beige-book-archive/2013-06-ch,0.7142857142857143,Nonresidential construction increased at a modest pace,201306,Chicago,"Real Estate, Construction",#92c5de
https://www.minneapolisfed.org/news-and-events/beige-book-archive/2013-06-ch,0.3,Auto sales were moderately higher,201306,Chicago,"Retail, Consumer Spending",#92c5de
https://www.minneapolisfed.org/news-and-events/beige-book-archive/2013-06-cl,0.375,Energy payrolls held steady,201306,Cleveland,"Agriculture, Energy, Natural Resources",#92c5de
https://www.minneapolisfed.org/news-and-events/beige-book-archive/2013-06-cl,0.5384615384615384,"Input and finished goods prices were stable, apart from increases in construction materials and natural gas",201306,Cleveland,Economy,#92c5de
https://www.minneapolisfed.org/news-and-events/beige-book-archive/2013-06-cl,0.75,"Demand for business credit has increased, but at a slower rate, since our last report",201306,Cleveland,Finance,#92c5de
https://www.minneapolisfed.org/news-and-events/beige-book-archive/2013-06-cl,0.5833333333333334,Raw material and finished goods prices were flat or trended lower,201306,Cleveland,"Manufacturing, Services",#92c5de
https://www.minneapolisfed.org/news-and-events/beige-book-archive/2013-06-cl,0.2631578947368421,"However, they cited difficulty in obtaining financing and low inventory as barriers to more robust growth in their industry",201306,Cleveland,"Real Estate, Construction",#D3D3D3
https://www.minneapolisfed.org/news-and-events/beige-book-archive/2013-06-cl,0.4375,"Going into summer, sales are projected to be modestly higher, when compared to the same time period last year",201306,Cleveland,"Retail, Consumer Spending",#92c5de
https://www.minneapolisfed.org/news-and-events/beige-book-archive/2013-06-da,1.0,Energy activity improved since the last report,201306,Dallas,"Agriculture, Energy, Natural Resources",#92c5de
https://www.minneapolisfed.org/news-and-events/beige-book-archive/2013-06-da,1.2666666666666666,"Retail sales activity improved during the reporting period, and auto sales held steady",201306,Dallas,Economy,#0571b0
https://www.minneapolisfed.org/news-and-events/beige-book-archive/2013-06-da,0.4666666666666667,Most responding firms said prices were steady and they expect increases to remain modest for the remainder of the year,201306,Dallas,"Employment, Prices, Wages",#92c5de
https://www.minneapolisfed.org/news-and-events/beige-book-archive/2013-06-da,0.875,Deposits increased modestly and deposit rates remained mostly unchanged,201306,Dallas,Finance,#92c5de
https://www.minneapolisfed.org/news-and-events/beige-book-archive/2013-06-da,0.6285714285714286,Contacts are slightly more optimistic,201306,Dallas,"Manufacturing, Services",#92c5de
https://www.minneapolisfed.org/news-and-events/beige-book-archive/2013-06-da,0.7142857142857143,"New home construction activity picked up pace since the last report, although some contacts mentioned higher prices may slow sales growth later in the year",201306,Dallas,"Real Estate, Construction",#92c5de
https://www.minneapolisfed.org/news-and-events/beige-book-archive/2013-06-da,1.0,"Contacts are positive in their outlooks for the remainder of the year, although increasing costs were a concern",201306,Dallas,"Retail, Consumer Spending",#92c5de
https://www.minneapolisfed.org/news-and-events/beige-book-archive/2013-06-kc,-0.1875,"Farmland values continued to rise, but at a slightly slower pace than last year",201306,Kansas City,"Agriculture, Energy, Natural Resources",#D3D3D3
https://www.minneapolisfed.org/news-and-events/beige-book-archive/2013-06-kc,0.75,"Wge pressures and labor shortages picked up slightly, but were limited to skilled positions",201306,Kansas City,Economy,#92c5de
https://www.minneapolisfed.org/news-and-events/beige-book-archive/2013-06-kc,0.4,"Similarly, raw material prices rose moderately for manufacturers",201306,Kansas City,"Employment, Prices, Wages",#92c5de
https://www.minneapolisfed.org/news-and-events/beige-book-archive/2013-06-kc,0.8666666666666667,"In the recent survey period, bankers generally reported slightly stronger loan demand, improving loan quality, and steady deposit levels",201306,Kansas City,Finance,#92c5de
https://www.minneapolisfed.org/news-and-events/beige-book-archive/2013-06-kc,1.0,"After contracting for seven months, District manufacturing activity increased modestly in May",201306,Kansas City,"Manufacturing, Services",#92c5de
https://www.minneapolisfed.org/news-and-events/beige-book-archive/2013-06-kc,0.8823529411764706,"Residential real estate activity remained strong, and commercial real estate improved modestly in late April and early May",201306,Kansas City,"Real Estate, Construction",#92c5de
https://www.minneapolisfed.org/news-and-events/beige-book-archive/2013-06-kc,0.2857142857142857,Restaurant sales declined slightly since the last survey but were expected to improve over the next few months,201306,Kansas City,"Retail, Consumer Spending",#D3D3D3
https://www.minneapolisfed.org/news-and-events/beige-book-archive/2013-06-mi,0.23076923076923078,"The energy sector remained strong, while mining activity slowed",201306,Minneapolis,"Agriculture, Energy, Natural Resources",#D3D3D3
https://www.minneapolisfed.org/news-and-events/beige-book-archive/2013-06-mi,0.625,"Wge increases were generally modest, and overall prices were stable, with some exceptions noted",201306,Minneapolis,Economy,#92c5de
https://www.minneapolisfed.org/news-and-events/beige-book-archive/2013-06-mi,0.09090909090909091,Wge increases were generally modest,201306,Minneapolis,"Employment, Prices, Wages",#D3D3D3
https://www.minneapolisfed.org/news-and-events/beige-book-archive/2013-06-mi,1.0,Manufacturing activity continued to expand moderately,201306,Minneapolis,"Manufacturing, Services",#92c5de
https://www.minneapolisfed.org/news-and-events/beige-book-archive/2013-06-mi,0.6,Residential real estate market activity increased at a solid pace,201306,Minneapolis,"Real Estate, Construction",#92c5de
https://www.minneapolisfed.org/news-and-events/beige-book-archive/2013-06-mi,1.0,Consumer spending grew slightly due in part to a late spring,201306,Minneapolis,"Retail, Consumer Spending",#92c5de
https://www.minneapolisfed.org/news-and-events/beige-book-archive/2013-06-su,-0.058823529411764705,"Farm incomes increased in the Minneapolis District, while farm income growth softened in the Kansas City District",201306,National Summary,"Agriculture, Energy, Natural Resources",#D3D3D3
https://www.minneapolisfed.org/news-and-events/beige-book-archive/2013-06-su,0.8148148148148148,"A wide variety of business services expanded, and transportation traffic increased for producer, consumer, and trade goods",201306,National Summary,Economy,#92c5de
https://www.minneapolisfed.org/news-and-events/beige-book-archive/2013-06-su,0.40540540540540543,Labor markets continued to improve slowly in the Chicago District,201306,National Summary,"Employment, Prices, Wages",#92c5de
https://www.minneapolisfed.org/news-and-events/beige-book-archive/2013-06-su,0.4,"Credit quality improved, on balance",201306,National Summary,Finance,#92c5de
https://www.minneapolisfed.org/news-and-events/beige-book-archive/2013-06-su,0.5853658536585366,Transportation activity increased,201306,National Summary,"Manufacturing, Services",#92c5de
https://www.minneapolisfed.org/news-and-events/beige-book-archive/2013-06-su,0.7,Commercial real estate and construction activity expanded at a modest to moderate pace in most Districts,201306,National Summary,"Real Estate, Construction",#92c5de
https://www.minneapolisfed.org/news-and-events/beige-book-archive/2013-06-su,0.6857142857142857,Vehicle sales generally increased moderately across Districts,201306,National Summary,"Retail, Consumer Spending",#92c5de
https://www.minneapolisfed.org/news-and-events/beige-book-archive/2013-06-ny,0.9166666666666666,"Labor market conditions continue to improve, and businesses increasingly report difficulty finding well-qualified workers",201306,New York,Economy,#92c5de
https://www.minneapolisfed.org/news-and-events/beige-book-archive/2013-06-ny,-0.25,"Interest rates on deposits continue to decline, on balance",201306,New York,Finance,#f4a582
https://www.minneapolisfed.org/news-and-events/beige-book-archive/2013-06-ny,1.05,"Wile the temp business remains strong, a growing number of firms are hiring full-time workers",201306,New York,"Manufacturing, Services",#92c5de
https://www.minneapolisfed.org/news-and-events/beige-book-archive/2013-06-ny,0.45454545454545453,"Northern New Jersey continues to see modest, steady improvement in its housing market",201306,New York,"Real Estate, Construction",#92c5de
https://www.minneapolisfed.org/news-and-events/beige-book-archive/2013-06-ny,0.7368421052631579,Tourism activity has been mixed but generally fairly robust since the last report,201306,New York,"Retail, Consumer Spending",#92c5de
https://www.minneapolisfed.org/news-and-events/beige-book-archive/2013-06-ph,1.0,Manufacturing appears to have declined somewhat after expanding slightly last period,201306,Philadelphia,Economy,#92c5de
https://www.minneapolisfed.org/news-and-events/beige-book-archive/2013-06-ph,0.3333333333333333,"Overall, price levels continued to increase slightly, similar to the previous Beige Book",201306,Philadelphia,"Employment, Prices, Wages",#92c5de
https://www.minneapolisfed.org/news-and-events/beige-book-archive/2013-06-ph,0.7272727272727273,"Credit card loan volumes were relatively unchanged, while reports of other consumer lending were mixed",201306,Philadelphia,Finance,#92c5de
https://www.minneapolisfed.org/news-and-events/beige-book-archive/2013-06-ph,1.0952380952380953,"In other sectors, staffing firms have reported strong increases in billable hours--an improvement since the prior Beige Book",201306,Philadelphia,"Manufacturing, Services",#92c5de
https://www.minneapolisfed.org/news-and-events/beige-book-archive/2013-06-ph,0.75,"Following a little softness, homebuilders throughout most of the Third District resumed a moderate growth of contracts signed for new construction",201306,Philadelphia,"Real Estate, Construction",#92c5de
https://www.minneapolisfed.org/news-and-events/beige-book-archive/2013-06-ph,1.3,"However, hiring plans remain tentative and modest; expectations of rising health-care costs further constrain the willingness of dealers to expand their workforces",201306,Philadelphia,"Retail, Consumer Spending",#0571b0
https://www.minneapolisfed.org/news-and-events/beige-book-archive/2013-06-ri,-0.4444444444444444,He indicated that natural gas had displaced coal in power plants due to the low price of natural gas and concerns regarding environmental regulatory changes,201306,Richmond,"Agriculture, Energy, Natural Resources",#f4a582
https://www.minneapolisfed.org/news-and-events/beige-book-archive/2013-06-ri,0.6363636363636364,"Retail sales flattened, although auto sales generally remained strong",201306,Richmond,Economy,#92c5de
https://www.minneapolisfed.org/news-and-events/beige-book-archive/2013-06-ri,0.45454545454545453,"According to our latest surveys, manufacturing employment edged down and average wage growth slowed",201306,Richmond,"Employment, Prices, Wages",#92c5de
https://www.minneapolisfed.org/news-and-events/beige-book-archive/2013-06-ri,-0.3333333333333333,Demand increased for residential mortgages,201306,Richmond,Finance,#f4a582
https://www.minneapolisfed.org/news-and-events/beige-book-archive/2013-06-ri,0.5384615384615384,"Fifth District manufacturing activity softened since our last report, although there were scattered reports of improvement",201306,Richmond,"Manufacturing, Services",#92c5de
https://www.minneapolisfed.org/news-and-events/beige-book-archive/2013-06-ri,0.9230769230769231,Commercial real estate and construction markets tightened slightly in recent weeks,201306,Richmond,"Real Estate, Construction",#92c5de
https://www.minneapolisfed.org/news-and-events/beige-book-archive/2013-06-ri,1.0,Surveyed contacts indicated that retail price increases slowed in recent weeks,201306,Richmond,"Retail, Consumer Spending",#92c5de
https://www.minneapolisfed.org/news-and-events/beige-book-archive/2013-06-sf,0.5,Agricultural sales and production increased modestly,201306,San Francisco,"Agriculture, Energy, Natural Resources",#92c5de
https://www.minneapolisfed.org/news-and-events/beige-book-archive/2013-06-sf,0.36363636363636365,Production and sales of agricultural items increased modestly,201306,San Francisco,Economy,#92c5de
https://www.minneapolisfed.org/news-and-events/beige-book-archive/2013-06-sf,0.1111111111111111,Price inflation was subdued for most final goods and services,201306,San Francisco,"Employment, Prices, Wages",#D3D3D3
https://www.minneapolisfed.org/news-and-events/beige-book-archive/2013-06-sf,0.25,Financial institutions reported that loan demand improved slightly on balance,201306,San Francisco,Finance,#D3D3D3
https://www.minneapolisfed.org/news-and-events/beige-book-archive/2013-06-sf,0.3333333333333333,"Pharmaceutical producers reported that innovative product launches contributed to continued modest gains for some firms, although overall activity seemed to be on a slight downward trajectory",201306,San Francisco,"Manufacturing, Services",#92c5de
https://www.minneapolisfed.org/news-and-events/beige-book-archive/2013-06-sf,0.375,"Residential real estate activity expanded robustly, and commercial real estate activity trended up at a more moderate pace overall",201306,San Francisco,"Real Estate, Construction",#92c5de
https://www.minneapolisfed.org/news-and-events/beige-book-archive/2013-06-sf,0.09090909090909091,Retail sales were fairly soft overall,201306,San Francisco,"Retail, Consumer Spending",#D3D3D3
https://www.minneapolisfed.org/news-and-events/beige-book-archive/2013-06-sl,0.6,"Across all other District states, soybean planting progress was approximately 15 percent slower than its 5-year average",201306,St. Louis,"Agriculture, Energy, Natural Resources",#92c5de
https://www.minneapolisfed.org/news-and-events/beige-book-archive/2013-06-sl,1.1111111111111112,Economic activity in the Eighth District has expanded at a moderate pace since the previous report,201306,St. Louis,Economy,#0571b0
https://www.minneapolisfed.org/news-and-events/beige-book-archive/2013-06-sl,0.375,"In turn, 30 percent of contacts noted that wages over the past three months have stayed the same, while 66 percent noted that wages have increased",201306,St. Louis,"Employment, Prices, Wages",#92c5de
https://www.minneapolisfed.org/news-and-events/beige-book-archive/2013-06-sl,0.42857142857142855,"Demand for auto loans ranged from moderately stronger to moderately weaker, while demand for other consumer loans was unchanged",201306,St. Louis,Finance,#92c5de
https://www.minneapolisfed.org/news-and-events/beige-book-archive/2013-06-sl,0.9090909090909091,A recent survey of manufacturers showed increased new orders and capacity utilization for the majority of firms,201306,St. Louis,"Manufacturing, Services",#92c5de
https://www.minneapolisfed.org/news-and-events/beige-book-archive/2013-06-sl,0.5,Commercial and industrial real estate market conditions have continued to improve moderately,201306,St. Louis,"Real Estate, Construction",#92c5de
https://www.minneapolisfed.org/news-and-events/beige-book-archive/2013-06-sl,0.3157894736842105,"Forty percent of contacts noted moderate increases in sales, while 40 percent noted minor decreases and the rest saw no changes",201306,St. Louis,"Retail, Consumer Spending",#92c5de
