link_URL,adjective_score,important_phrase,Date,District,Category,color
https://www.minneapolisfed.org/news-and-events/beige-book-archive/2013-07-at,1.4444444444444444,Pasture conditions improved as well,201307,Atlanta,"Agriculture, Energy, Natural Resources",#0571b0
https://www.minneapolisfed.org/news-and-events/beige-book-archive/2013-07-at,0.9333333333333333,"Manufacturing firms indicated that activity grew, albeit at a slower rate than in our previous report",201307,Atlanta,Economy,#92c5de
https://www.minneapolisfed.org/news-and-events/beige-book-archive/2013-07-at,0.875,"In general, most input costs remained relatively stable, helping to support slightly stronger profit margins in the face of improving, but still below pre-recession sales levels",201307,Atlanta,"Employment, Prices, Wages",#92c5de
https://www.minneapolisfed.org/news-and-events/beige-book-archive/2013-07-at,0.4,"They also indicated that while mortgage refinancing had slowed, new purchase loan demand had increased",201307,Atlanta,Finance,#92c5de
https://www.minneapolisfed.org/news-and-events/beige-book-archive/2013-07-at,0.4,"Regional manufacturers reported expanding activity; however, the rate of growth slowed as a result of a decrease in new orders, production, and finished inventory",201307,Atlanta,"Manufacturing, Services",#92c5de
https://www.minneapolisfed.org/news-and-events/beige-book-archive/2013-07-at,1.1666666666666667,Commercial brokers indicated that demand for space improved at a modest pace,201307,Atlanta,"Real Estate, Construction",#0571b0
https://www.minneapolisfed.org/news-and-events/beige-book-archive/2013-07-at,1.0769230769230769,"Wile most merchants experienced modest growth, growth was lower than expected in some cases",201307,Atlanta,"Retail, Consumer Spending",#92c5de
https://www.minneapolisfed.org/news-and-events/beige-book-archive/2013-07-bo,1.0,"Overall prices are rising at a modest pace, generally in line with cost increases",201307,Boston,Economy,#92c5de
https://www.minneapolisfed.org/news-and-events/beige-book-archive/2013-07-bo,0.8333333333333334,Most of the 13 manufacturers contacted in this round report modest increases in sales,201307,Boston,"Manufacturing, Services",#92c5de
https://www.minneapolisfed.org/news-and-events/beige-book-archive/2013-07-bo,0.7142857142857143,"The outlook among First District contacts is for slow improvement in fundamentals for the rest of 2013, but some downside risks were noted",201307,Boston,"Real Estate, Construction",#92c5de
https://www.minneapolisfed.org/news-and-events/beige-book-archive/2013-07-bo,0.8888888888888888,"Restaurant revenues are up 2 percent, slightly better than expected",201307,Boston,"Retail, Consumer Spending",#92c5de
https://www.minneapolisfed.org/news-and-events/beige-book-archive/2013-07-ch,0.7142857142857143,"Crop conditions improved over the course of the reporting period, with the crop ending the period in better shape than a year ago",201307,Chicago,"Agriculture, Energy, Natural Resources",#92c5de
https://www.minneapolisfed.org/news-and-events/beige-book-archive/2013-07-ch,1.3,Credit conditions tightened moderately,201307,Chicago,Economy,#0571b0
https://www.minneapolisfed.org/news-and-events/beige-book-archive/2013-07-ch,0.6666666666666666,"Retailers again reported mostly modest increases in wholesale prices; and, overall, pass-through to downstream prices was limited",201307,Chicago,"Employment, Prices, Wages",#92c5de
https://www.minneapolisfed.org/news-and-events/beige-book-archive/2013-07-ch,0.75,Credit conditions tightened moderately over the reporting period,201307,Chicago,Finance,#92c5de
https://www.minneapolisfed.org/news-and-events/beige-book-archive/2013-07-ch,0.2692307692307692,Labor market conditions continued to improve slowly,201307,Chicago,"Manufacturing, Services",#D3D3D3
https://www.minneapolisfed.org/news-and-events/beige-book-archive/2013-07-ch,0.9166666666666666,"A homebuilder noted that while new single-family development remained limited, improvement of vacant lots in existing developments was increasing",201307,Chicago,"Real Estate, Construction",#92c5de
https://www.minneapolisfed.org/news-and-events/beige-book-archive/2013-07-ch,1.3333333333333333,Growth in consumer spending increased in June,201307,Chicago,"Retail, Consumer Spending",#0571b0
https://www.minneapolisfed.org/news-and-events/beige-book-archive/2013-07-cl,0.2857142857142857,Wll-head prices were little changed,201307,Cleveland,"Agriculture, Energy, Natural Resources",#D3D3D3
https://www.minneapolisfed.org/news-and-events/beige-book-archive/2013-07-cl,0.9090909090909091,Demand for credit increased slightly,201307,Cleveland,Economy,#92c5de
https://www.minneapolisfed.org/news-and-events/beige-book-archive/2013-07-cl,0.5,Residential mortgage activity remains relatively strong,201307,Cleveland,Finance,#92c5de
https://www.minneapolisfed.org/news-and-events/beige-book-archive/2013-07-cl,0.2608695652173913,"Factories expanded payrolls at a modest pace, although finding qualified production and salaried personnel was difficult",201307,Cleveland,"Manufacturing, Services",#D3D3D3
https://www.minneapolisfed.org/news-and-events/beige-book-archive/2013-07-cl,0.7272727272727273,Inquiries have picked up and backlogs are slowly rising,201307,Cleveland,"Real Estate, Construction",#92c5de
https://www.minneapolisfed.org/news-and-events/beige-book-archive/2013-07-cl,0.6923076923076923,Monies are allocated primarily for store improvements and expansions,201307,Cleveland,"Retail, Consumer Spending",#92c5de
https://www.minneapolisfed.org/news-and-events/beige-book-archive/2013-07-da,0.625,"Global demand held steady, although there was some weakness from Mexico and Canada",201307,Dallas,"Agriculture, Energy, Natural Resources",#92c5de
https://www.minneapolisfed.org/news-and-events/beige-book-archive/2013-07-da,0.5,"However, retail sales were flat after rising in the previous six weeks, and auto sales softened slightly",201307,Dallas,Economy,#92c5de
https://www.minneapolisfed.org/news-and-events/beige-book-archive/2013-07-da,0.5,Gasoline prices edged down and diesel prices increased,201307,Dallas,"Employment, Prices, Wages",#92c5de
https://www.minneapolisfed.org/news-and-events/beige-book-archive/2013-07-da,1.125,Demand for auto loans grew strongly,201307,Dallas,Finance,#0571b0
https://www.minneapolisfed.org/news-and-events/beige-book-archive/2013-07-da,1.0,Manufacturing activity improved slightly over the reporting period,201307,Dallas,"Manufacturing, Services",#92c5de
https://www.minneapolisfed.org/news-and-events/beige-book-archive/2013-07-da,0.5,"Single-family home sales continued to outpace supply, leading to very low inventories and rapid price increases",201307,Dallas,"Real Estate, Construction",#92c5de
https://www.minneapolisfed.org/news-and-events/beige-book-archive/2013-07-da,1.1111111111111112,Automobile sales were slightly softer than six weeks ago but remained strong,201307,Dallas,"Retail, Consumer Spending",#0571b0
https://www.minneapolisfed.org/news-and-events/beige-book-archive/2013-07-kc,0.875,"Ethanol production continued to edge higher, and inventories trended down as profitability in the sector improved modestly",201307,Kansas City,"Agriculture, Energy, Natural Resources",#92c5de
https://www.minneapolisfed.org/news-and-events/beige-book-archive/2013-07-kc,1.1428571428571428,"The Tenth District economy grew modestly in June, and expectations for future activity improved slightly",201307,Kansas City,Economy,#0571b0
https://www.minneapolisfed.org/news-and-events/beige-book-archive/2013-07-kc,0.42857142857142855,"The percentage of firms reporting labor shortages increased slightly, but recent wage increases remained modest",201307,Kansas City,"Employment, Prices, Wages",#92c5de
https://www.minneapolisfed.org/news-and-events/beige-book-archive/2013-07-kc,0.7142857142857143,"Bankers reported slightly stronger overall loan demand, moderately improved loan quality, and slightly lower deposit levels",201307,Kansas City,Finance,#92c5de
https://www.minneapolisfed.org/news-and-events/beige-book-archive/2013-07-kc,-0.2857142857142857,"Manufacturing activity contracted slightly in June, while high-tech activity rose and transportation was flat",201307,Kansas City,"Manufacturing, Services",#f4a582
https://www.minneapolisfed.org/news-and-events/beige-book-archive/2013-07-kc,0.7692307692307693,"Contacts expected stronger activity in coming months, but several noted uncertainty around rising interest rates",201307,Kansas City,"Real Estate, Construction",#92c5de
https://www.minneapolisfed.org/news-and-events/beige-book-archive/2013-07-kc,0.25,"Purchases of large ticket items, such as appliances, slowed relative to lower-priced goods",201307,Kansas City,"Retail, Consumer Spending",#D3D3D3
https://www.minneapolisfed.org/news-and-events/beige-book-archive/2013-07-mi,0.125,"Activity in the energy sector increased moderately, while mining activity was sluggish",201307,Minneapolis,"Agriculture, Energy, Natural Resources",#D3D3D3
https://www.minneapolisfed.org/news-and-events/beige-book-archive/2013-07-mi,0.6153846153846154,"Labor markets continued to tighten slightly, and wage increases were moderate",201307,Minneapolis,Economy,#92c5de
https://www.minneapolisfed.org/news-and-events/beige-book-archive/2013-07-mi,-0.2,Wge increases were moderate,201307,Minneapolis,"Employment, Prices, Wages",#D3D3D3
https://www.minneapolisfed.org/news-and-events/beige-book-archive/2013-07-mi,1.4285714285714286,"In Minneapolis, a technology consulting firm reported a recent expansion and an intellectual property protection firm is expanding",201307,Minneapolis,"Manufacturing, Services",#0571b0
https://www.minneapolisfed.org/news-and-events/beige-book-archive/2013-07-mi,1.0,Residential real estate market activity increased at a robust pace,201307,Minneapolis,"Real Estate, Construction",#92c5de
https://www.minneapolisfed.org/news-and-events/beige-book-archive/2013-07-mi,0.7058823529411765,Consumer spending increased modestly,201307,Minneapolis,"Retail, Consumer Spending",#92c5de
https://www.minneapolisfed.org/news-and-events/beige-book-archive/2013-07-su,0.5384615384615384,"Drilling declined in the Cleveland District, was flat in the Kansas City District, and increased in the Richmond District",201307,National Summary,"Agriculture, Energy, Natural Resources",#92c5de
https://www.minneapolisfed.org/news-and-events/beige-book-archive/2013-07-su,1.0344827586206897,"Credit quality improved, while credit standards remained largely unchanged",201307,National Summary,Economy,#92c5de
https://www.minneapolisfed.org/news-and-events/beige-book-archive/2013-07-su,0.6842105263157895,Hiring held steady or increased at a measured pace in most Districts,201307,National Summary,"Employment, Prices, Wages",#92c5de
https://www.minneapolisfed.org/news-and-events/beige-book-archive/2013-07-su,0.7777777777777778,Reports on credit quality indicated slight to moderate improvements across the reporting Districts,201307,National Summary,Finance,#92c5de
https://www.minneapolisfed.org/news-and-events/beige-book-archive/2013-07-su,0.9705882352941176,Specialty metal manufacturers in Chicago saw modest improvement in demand,201307,National Summary,"Manufacturing, Services",#92c5de
https://www.minneapolisfed.org/news-and-events/beige-book-archive/2013-07-su,1.0476190476190477,Residential real estate activity increased at a moderate to strong pace in most Districts,201307,National Summary,"Real Estate, Construction",#92c5de
https://www.minneapolisfed.org/news-and-events/beige-book-archive/2013-07-su,0.9032258064516129,Most Districts noted that overall consumer spending increased during the reporting period,201307,National Summary,"Retail, Consumer Spending",#92c5de
https://www.minneapolisfed.org/news-and-events/beige-book-archive/2013-07-ny,0.7,Tourism activity remains steady at a strong level,201307,New York,Economy,#92c5de
https://www.minneapolisfed.org/news-and-events/beige-book-archive/2013-07-ny,-0.75,Bankers report increased demand for commercial mortgages but decreased demand for residential mortgages,201307,New York,Finance,#f4a582
https://www.minneapolisfed.org/news-and-events/beige-book-archive/2013-07-ny,0.45454545454545453,Two major employment agencies describe market fundamentals as favorable but note that the market is difficult to gauge at this typically slow time of year,201307,New York,"Manufacturing, Services",#92c5de
https://www.minneapolisfed.org/news-and-events/beige-book-archive/2013-07-ny,0.3333333333333333,"New Jerseys housing market has shown more modest signs of improvement: prices are rising slowly, reportedly restrained by an ongoing backlog of distressed properties on the market",201307,New York,"Real Estate, Construction",#92c5de
https://www.minneapolisfed.org/news-and-events/beige-book-archive/2013-07-ny,0.5714285714285714,Tourism activity has been mixed but generally fairly robust since the last report,201307,New York,"Retail, Consumer Spending",#92c5de
https://www.minneapolisfed.org/news-and-events/beige-book-archive/2013-07-ph,0.7368421052631579,Contacts reported slight increases overall--similar to the last Beige Book period,201307,Philadelphia,Economy,#92c5de
https://www.minneapolisfed.org/news-and-events/beige-book-archive/2013-07-ph,0.5555555555555556,Manufacturing firms reported modest increases for prices paid and prices received,201307,Philadelphia,"Employment, Prices, Wages",#92c5de
https://www.minneapolisfed.org/news-and-events/beige-book-archive/2013-07-ph,0.5,"Overall, Third District financial firms reported modest increases in total loan volume--a slight improvement since the previous Beige Book",201307,Philadelphia,Finance,#92c5de
https://www.minneapolisfed.org/news-and-events/beige-book-archive/2013-07-ph,0.7777777777777778,"Other service-sector firms reported ""incrementally better"" growth, tight margins, and cautious hiring",201307,Philadelphia,"Manufacturing, Services",#92c5de
https://www.minneapolisfed.org/news-and-events/beige-book-archive/2013-07-ph,0.8333333333333334,"Overall, contacts remained optimistic for a continuation of slow, steady growth",201307,Philadelphia,"Real Estate, Construction",#92c5de
https://www.minneapolisfed.org/news-and-events/beige-book-archive/2013-07-ph,1.1428571428571428,"Mall operators reported that the general retail climate has improved, citing stronger demand for retail space and rising occupancy rates",201307,Philadelphia,"Retail, Consumer Spending",#0571b0
https://www.minneapolisfed.org/news-and-events/beige-book-archive/2013-07-ri,0.0,Recent reports on agricultural conditions were mixed,201307,Richmond,"Agriculture, Energy, Natural Resources",#D3D3D3
https://www.minneapolisfed.org/news-and-events/beige-book-archive/2013-07-ri,0.4444444444444444,District economic activity strengthened moderately in recent weeks,201307,Richmond,Economy,#92c5de
https://www.minneapolisfed.org/news-and-events/beige-book-archive/2013-07-ri,0.5,"According to our latest surveys, wage growth picked up in the manufacturing sector, remained robust at non-retail establishments, and flattened at retail businesses",201307,Richmond,"Employment, Prices, Wages",#92c5de
https://www.minneapolisfed.org/news-and-events/beige-book-archive/2013-07-ri,0.0,Banking activity increased slightly since our last assessment,201307,Richmond,Finance,#D3D3D3
https://www.minneapolisfed.org/news-and-events/beige-book-archive/2013-07-ri,0.46153846153846156,Tourism picked up,201307,Richmond,"Manufacturing, Services",#92c5de
https://www.minneapolisfed.org/news-and-events/beige-book-archive/2013-07-ri,0.375,Residential real estate sales expanded,201307,Richmond,"Real Estate, Construction",#92c5de
https://www.minneapolisfed.org/news-and-events/beige-book-archive/2013-07-ri,1.0,Retail price growth slowed since our last report,201307,Richmond,"Retail, Consumer Spending",#92c5de
https://www.minneapolisfed.org/news-and-events/beige-book-archive/2013-07-sf,0.5,Agricultural sales and production activity expanded,201307,San Francisco,"Agriculture, Energy, Natural Resources",#92c5de
https://www.minneapolisfed.org/news-and-events/beige-book-archive/2013-07-sf,1.0,District manufacturing activity improved,201307,San Francisco,Economy,#92c5de
https://www.minneapolisfed.org/news-and-events/beige-book-archive/2013-07-sf,0.8333333333333334,Price inflation was minimal for most final goods and services,201307,San Francisco,"Employment, Prices, Wages",#92c5de
https://www.minneapolisfed.org/news-and-events/beige-book-archive/2013-07-sf,0.3,"However, hiring plans were mixed, with some financial institutions expecting to expand their payrolls significantly and others mentioning possible layoffs",201307,San Francisco,Finance,#92c5de
https://www.minneapolisfed.org/news-and-events/beige-book-archive/2013-07-sf,0.5,"Although demand was weak for some electronic components, contacts indicated substantial increases in new orders for semiconductors",201307,San Francisco,"Manufacturing, Services",#92c5de
https://www.minneapolisfed.org/news-and-events/beige-book-archive/2013-07-sf,0.3333333333333333,"Commercial real estate activity expanded rapidly in some major metropolitan areas, even though construction of publicly funded commercial projects has slowed in some regions due to funding constraints from state and local governments",201307,San Francisco,"Real Estate, Construction",#92c5de
https://www.minneapolisfed.org/news-and-events/beige-book-archive/2013-07-sf,0.5789473684210527,Retail sales grew modestly,201307,San Francisco,"Retail, Consumer Spending",#92c5de
https://www.minneapolisfed.org/news-and-events/beige-book-archive/2013-07-sl,0.875,"Furthermore, at least 70 percent of total pastureland across the District states was rated in good or excellent condition",201307,St. Louis,"Agriculture, Energy, Natural Resources",#92c5de
https://www.minneapolisfed.org/news-and-events/beige-book-archive/2013-07-sl,1.3333333333333333,The economy of the Eighth District has expanded at a moderate pace since our previous report,201307,St. Louis,Economy,#0571b0
https://www.minneapolisfed.org/news-and-events/beige-book-archive/2013-07-sl,0.7142857142857143,"Total loans outstanding at a sample of small and midsized District banks increased , percent from mid-March to mid-June",201307,St. Louis,Finance,#92c5de
https://www.minneapolisfed.org/news-and-events/beige-book-archive/2013-07-sl,1.0,"However, many retail contacts noted that year-to-date sales were below expectations, and contacts were cautiously optimistic about sales for the remainder of 2013",201307,St. Louis,"Manufacturing, Services",#92c5de
https://www.minneapolisfed.org/news-and-events/beige-book-archive/2013-07-sl,0.38461538461538464,Commercial and industrial real estate market conditions have continued to improve moderately throughout most of the District,201307,St. Louis,"Real Estate, Construction",#92c5de
