link_URL,adjective_score,important_phrase,Date,District,Category,color
https://www.minneapolisfed.org/news-and-events/beige-book-archive/2013-03-at,1.0,"Recent rains improved drought conditions in Alabama and Georgia, while Florida saw dry conditions expand over most of the state",201303,Atlanta,"Agriculture, Energy, Natural Resources",#92c5de
https://www.minneapolisfed.org/news-and-events/beige-book-archive/2013-03-at,0.8,Hiring in District labor markets expanded at a modest pace and prices generally remained flat compared with late last year,201303,Atlanta,Economy,#92c5de
https://www.minneapolisfed.org/news-and-events/beige-book-archive/2013-03-at,0.5882352941176471,"Looking forward, business expectations for inflation have been relatively stable",201303,Atlanta,"Employment, Prices, Wages",#92c5de
https://www.minneapolisfed.org/news-and-events/beige-book-archive/2013-03-at,1.6666666666666667,Auto loan activity remained strong,201303,Atlanta,Finance,#0571b0
https://www.minneapolisfed.org/news-and-events/beige-book-archive/2013-03-at,1.3333333333333333,Several District port contacts continued to report significant investment in infrastructure and equipment improvements,201303,Atlanta,"Manufacturing, Services",#0571b0
https://www.minneapolisfed.org/news-and-events/beige-book-archive/2013-03-at,1.2857142857142858,Commercial contractors reported that construction improved modestly from late last year,201303,Atlanta,"Real Estate, Construction",#0571b0
https://www.minneapolisfed.org/news-and-events/beige-book-archive/2013-03-at,0.8,"Domestic travel and tourism also remained healthy, despite concerns about rising gas prices",201303,Atlanta,"Retail, Consumer Spending",#92c5de
https://www.minneapolisfed.org/news-and-events/beige-book-archive/2013-03-bo,0.7,"Economic activity continues to expand in the First District, albeit slowly, according to business contacts",201303,Boston,Economy,#92c5de
https://www.minneapolisfed.org/news-and-events/beige-book-archive/2013-03-bo,0.8333333333333334,"Contacts continue to have difficulty finding candidates with high-end skill sets such as mechanical and electrical engineers, software developers, and IT personnel; one respondent says this shortage of qualified labor is putting upward pressure on pay rates",201303,Boston,"Employment, Prices, Wages",#92c5de
https://www.minneapolisfed.org/news-and-events/beige-book-archive/2013-03-bo,0.18181818181818182,Many contacts continue to slow the pace at which they are hiring,201303,Boston,"Manufacturing, Services",#D3D3D3
https://www.minneapolisfed.org/news-and-events/beige-book-archive/2013-03-bo,0.34615384615384615,"Some contacts, however, say the strength of the improvements could be easily undermined if the economic recovery slows",201303,Boston,"Real Estate, Construction",#92c5de
https://www.minneapolisfed.org/news-and-events/beige-book-archive/2013-03-bo,0.9090909090909091,Wolesale prices are reportedly holding steady,201303,Boston,"Retail, Consumer Spending",#92c5de
https://www.minneapolisfed.org/news-and-events/beige-book-archive/2013-03-ch,-0.6666666666666666,Lower feed costs aided the cash flows of livestock operations,201303,Chicago,"Agriculture, Energy, Natural Resources",#f4a582
https://www.minneapolisfed.org/news-and-events/beige-book-archive/2013-03-ch,0.1,"Growth in consumer and business spending slowed during the latest reporting period, but the pace of manufacturing production improved",201303,Chicago,Economy,#D3D3D3
https://www.minneapolisfed.org/news-and-events/beige-book-archive/2013-03-ch,0.875,Cost pressures were moderately higher in January and February,201303,Chicago,"Employment, Prices, Wages",#92c5de
https://www.minneapolisfed.org/news-and-events/beige-book-archive/2013-03-ch,0.0,"Banking contacts reported moderate growth in business and consumer loan demand, with pricing relatively unchanged but some loosening of loan standards",201303,Chicago,Finance,#D3D3D3
https://www.minneapolisfed.org/news-and-events/beige-book-archive/2013-03-ch,0.4,Hiring continued to increase slowly,201303,Chicago,"Manufacturing, Services",#92c5de
https://www.minneapolisfed.org/news-and-events/beige-book-archive/2013-03-ch,0.09090909090909091,"Commercial real estate leasing activity was generally unchanged--rents held steady, while vacancy rates continued to come down slowly",201303,Chicago,"Real Estate, Construction",#D3D3D3
https://www.minneapolisfed.org/news-and-events/beige-book-archive/2013-03-ch,0.16666666666666666,Consumer spending increased at a slower rate in January and February,201303,Chicago,"Retail, Consumer Spending",#D3D3D3
https://www.minneapolisfed.org/news-and-events/beige-book-archive/2013-03-cl,0.0,"In contrast, shale gas activity expanded at a robust pace",201303,Cleveland,"Agriculture, Energy, Natural Resources",#D3D3D3
https://www.minneapolisfed.org/news-and-events/beige-book-archive/2013-03-cl,0.7142857142857143,Nonresidential construction showed some slowing,201303,Cleveland,Economy,#92c5de
https://www.minneapolisfed.org/news-and-events/beige-book-archive/2013-03-cl,0.5714285714285714,Delinquency rates held steady or declined across consumer and commercial loan categories,201303,Cleveland,Finance,#92c5de
https://www.minneapolisfed.org/news-and-events/beige-book-archive/2013-03-cl,0.391304347826087,Finished goods prices held steady,201303,Cleveland,"Manufacturing, Services",#92c5de
https://www.minneapolisfed.org/news-and-events/beige-book-archive/2013-03-cl,0.26666666666666666,"Our contacts are cautious about near-term activity and expect slow to moderate growth, mainly from private- sector clients",201303,Cleveland,"Real Estate, Construction",#D3D3D3
https://www.minneapolisfed.org/news-and-events/beige-book-archive/2013-03-cl,1.1176470588235294,Sales of used vehicles rose moderately during January,201303,Cleveland,"Retail, Consumer Spending",#0571b0
https://www.minneapolisfed.org/news-and-events/beige-book-archive/2013-03-da,-0.2857142857142857,Grain exports were lower than expected,201303,Dallas,"Agriculture, Energy, Natural Resources",#f4a582
https://www.minneapolisfed.org/news-and-events/beige-book-archive/2013-03-da,0.26666666666666666,Housing demand remained strong and commercial real estate activity improved,201303,Dallas,Economy,#D3D3D3
https://www.minneapolisfed.org/news-and-events/beige-book-archive/2013-03-da,0.8666666666666667,Employment held steady or increased at most firms,201303,Dallas,"Employment, Prices, Wages",#92c5de
https://www.minneapolisfed.org/news-and-events/beige-book-archive/2013-03-da,0.1,"Consumer lending activity increased modestly, while real estate loan demand was limited",201303,Dallas,Finance,#D3D3D3
https://www.minneapolisfed.org/news-and-events/beige-book-archive/2013-03-da,-0.075,Outlooks were cautious,201303,Dallas,"Manufacturing, Services",#D3D3D3
https://www.minneapolisfed.org/news-and-events/beige-book-archive/2013-03-da,1.1428571428571428,Realtors noted that extremely low inventories were leading to price increases,201303,Dallas,"Real Estate, Construction",#0571b0
https://www.minneapolisfed.org/news-and-events/beige-book-archive/2013-03-da,0.8,"Outlooks were optimistic, with contacts expecting steady improvement through the first quarter and low- to mid-single digit increases in 2013 over 2012",201303,Dallas,"Retail, Consumer Spending",#92c5de
https://www.minneapolisfed.org/news-and-events/beige-book-archive/2013-03-kc,0.058823529411764705,"In the energy sector, activity in the district improved slightly during the survey period and contacts expected further moderate improvement in the coming months",201303,Kansas City,"Agriculture, Energy, Natural Resources",#D3D3D3
https://www.minneapolisfed.org/news-and-events/beige-book-archive/2013-03-kc,0.45454545454545453,The Tenth District economy showed modest improvement in January and early February,201303,Kansas City,Economy,#92c5de
https://www.minneapolisfed.org/news-and-events/beige-book-archive/2013-03-kc,0.16666666666666666,Organizations that serve low- and moderate-income households also noted some improvement in job availability,201303,Kansas City,"Employment, Prices, Wages",#D3D3D3
https://www.minneapolisfed.org/news-and-events/beige-book-archive/2013-03-kc,0.6428571428571429,"Bankers generally reported steady or modest loan demand, improving loan quality, and little change in total deposits in the recent survey period",201303,Kansas City,Finance,#92c5de
https://www.minneapolisfed.org/news-and-events/beige-book-archive/2013-03-kc,0.5714285714285714,Factory managers continued to be moderately optimistic about future activity,201303,Kansas City,"Manufacturing, Services",#92c5de
https://www.minneapolisfed.org/news-and-events/beige-book-archive/2013-03-kc,0.35714285714285715,Contacts also cited continued low borrowing rates and improved overall confidence in the economy as reasons for optimism,201303,Kansas City,"Real Estate, Construction",#92c5de
https://www.minneapolisfed.org/news-and-events/beige-book-archive/2013-03-kc,-0.09090909090909091,Automobile sales expectations improved for the near term,201303,Kansas City,"Retail, Consumer Spending",#D3D3D3
https://www.minneapolisfed.org/news-and-events/beige-book-archive/2013-03-mi,-0.14285714285714285,"Activity in the energy sector was mixed, while mining slowed",201303,Minneapolis,"Agriculture, Energy, Natural Resources",#D3D3D3
https://www.minneapolisfed.org/news-and-events/beige-book-archive/2013-03-mi,1.0,"Labor markets tightened modestly, and wage increases were moderate",201303,Minneapolis,Economy,#92c5de
https://www.minneapolisfed.org/news-and-events/beige-book-archive/2013-03-mi,0.4444444444444444,Overall wage increases remained moderate,201303,Minneapolis,"Employment, Prices, Wages",#92c5de
https://www.minneapolisfed.org/news-and-events/beige-book-archive/2013-03-mi,0.75,"The rate of increase was slower in Minnesota from the previous month, due mostly to weaker nondurable goods production",201303,Minneapolis,"Manufacturing, Services",#92c5de
https://www.minneapolisfed.org/news-and-events/beige-book-archive/2013-03-mi,0.9166666666666666,Residential real estate market activity increased at a strong pace,201303,Minneapolis,"Real Estate, Construction",#92c5de
https://www.minneapolisfed.org/news-and-events/beige-book-archive/2013-03-mi,1.0,Consumer spending posted modest gains,201303,Minneapolis,"Retail, Consumer Spending",#92c5de
https://www.minneapolisfed.org/news-and-events/beige-book-archive/2013-03-su,0.18181818181818182,Energy activity remained mixed with modest expansions in crude oil and natural gas exploration but slower mining activity,201303,National Summary,"Agriculture, Energy, Natural Resources",#D3D3D3
https://www.minneapolisfed.org/news-and-events/beige-book-archive/2013-03-su,0.6611111111111111,"The Chicago District said consumer spending increased at a slower rate, while Cleveland and Atlanta noted mixed sales activity",201303,National Summary,Economy,#92c5de
https://www.minneapolisfed.org/news-and-events/beige-book-archive/2013-03-su,0.875,"Labor market conditions generally improved, although several Districts reported restrained hiring",201303,National Summary,"Employment, Prices, Wages",#92c5de
https://www.minneapolisfed.org/news-and-events/beige-book-archive/2013-03-su,0.8888888888888888,Loan demand was steady or increased across all the Districts that reported,201303,National Summary,Finance,#92c5de
https://www.minneapolisfed.org/news-and-events/beige-book-archive/2013-03-su,0.43333333333333335,"Manufacturing conditions improved in nearly all Districts, but the increases were generally modest",201303,National Summary,"Manufacturing, Services",#92c5de
https://www.minneapolisfed.org/news-and-events/beige-book-archive/2013-03-su,0.19047619047619047,Overall commercial real estate conditions were mixed or slightly improved in most Districts,201303,National Summary,"Real Estate, Construction",#D3D3D3
https://www.minneapolisfed.org/news-and-events/beige-book-archive/2013-03-su,0.625,"The Chicago District said consumer spending increased at a slower rate, while Cleveland and Atlanta noted mixed sales activity",201303,National Summary,"Retail, Consumer Spending",#92c5de
https://www.minneapolisfed.org/news-and-events/beige-book-archive/2013-03-ny,1.0769230769230769,"The labor market has shown scattered signs of improvement: manufacturers report an upturn in hiring, and a major employment agency notes increasingly strong demand for temps",201303,New York,Economy,#92c5de
https://www.minneapolisfed.org/news-and-events/beige-book-archive/2013-03-ny,0.0,Small- to medium-sized banks report steady demand for consumer loans but increased demand for all other categories of loans; demand for refinancing was unchanged,201303,New York,Finance,#D3D3D3
https://www.minneapolisfed.org/news-and-events/beige-book-archive/2013-03-ny,1.2727272727272727,"A major employment agency reports that demand for full-time workers has improved slowly but steadily; while potential employers note that strong job candidates are increasingly hard to find, most continue to hold the line on salaries",201303,New York,"Manufacturing, Services",#0571b0
https://www.minneapolisfed.org/news-and-events/beige-book-archive/2013-03-ny,0.5789473684210527,"Realtors in the Buffalo area report continued favorable conditions in the housing market: prices have risen steadily at a moderate pace, inventory levels are fairly low, and sales activity has been steady",201303,New York,"Real Estate, Construction",#92c5de
https://www.minneapolisfed.org/news-and-events/beige-book-archive/2013-03-ny,0.38461538461538464,Retailers report that sales were strong in January but mixed in early February,201303,New York,"Retail, Consumer Spending",#92c5de
https://www.minneapolisfed.org/news-and-events/beige-book-archive/2013-03-ph,0.3684210526315789,Ongoing uncertainty over fiscal issues has postponed many business decisions,201303,Philadelphia,Economy,#92c5de
https://www.minneapolisfed.org/news-and-events/beige-book-archive/2013-03-ph,0.125,"Cost factors among manufacturing firms moderated a little, while the prices they received fell slightly",201303,Philadelphia,"Employment, Prices, Wages",#D3D3D3
https://www.minneapolisfed.org/news-and-events/beige-book-archive/2013-03-ph,0.1111111111111111,Consumer lending is relatively flat,201303,Philadelphia,Finance,#D3D3D3
https://www.minneapolisfed.org/news-and-events/beige-book-archive/2013-03-ph,0.6363636363636364,"Some of the current weakness was attributed to greater volatility in production swings associated with overall slow growth, a high level of uncertainty, and a reluctance to build inventories",201303,Philadelphia,"Manufacturing, Services",#92c5de
https://www.minneapolisfed.org/news-and-events/beige-book-archive/2013-03-ph,0.875,"As with new home construction, existing home sales are growing from a low base",201303,Philadelphia,"Real Estate, Construction",#92c5de
https://www.minneapolisfed.org/news-and-events/beige-book-archive/2013-03-ph,0.6666666666666666,They report that more hiring will occur if the recovery is sustained after more of the fiscal uncertainties are resolved,201303,Philadelphia,"Retail, Consumer Spending",#92c5de
https://www.minneapolisfed.org/news-and-events/beige-book-archive/2013-03-ri,1.5,"The agricultural sector remained strong, while energy production declined slightly",201303,Richmond,"Agriculture, Energy, Natural Resources",#0571b0
https://www.minneapolisfed.org/news-and-events/beige-book-archive/2013-03-ri,0.625,District economic activity grew moderately since our last report,201303,Richmond,Economy,#92c5de
https://www.minneapolisfed.org/news-and-events/beige-book-archive/2013-03-ri,0.35714285714285715,"According to our latest survey, average retail wages rose quickly and average wages at non-retail services firms picked up moderately in recent weeks; hiring, however, was still soft",201303,Richmond,"Employment, Prices, Wages",#92c5de
https://www.minneapolisfed.org/news-and-events/beige-book-archive/2013-03-ri,0.1111111111111111,"Commercial loans rose modestly, although demand remained weak",201303,Richmond,Finance,#D3D3D3
https://www.minneapolisfed.org/news-and-events/beige-book-archive/2013-03-ri,0.5,"According to our latest survey, raw materials prices grew at a slightly slower pace, while finished goods prices were little changed",201303,Richmond,"Manufacturing, Services",#92c5de
https://www.minneapolisfed.org/news-and-events/beige-book-archive/2013-03-ri,0.2727272727272727,Commercial real estate and construction markets improved somewhat since our last report,201303,Richmond,"Real Estate, Construction",#D3D3D3
https://www.minneapolisfed.org/news-and-events/beige-book-archive/2013-03-ri,1.0,""" Growth in retail prices slowed since our last report",201303,Richmond,"Retail, Consumer Spending",#92c5de
https://www.minneapolisfed.org/news-and-events/beige-book-archive/2013-03-sf,0.4,"In some slower-growing regions, demand for new gas and electric hookups remains tepid",201303,San Francisco,"Agriculture, Energy, Natural Resources",#92c5de
https://www.minneapolisfed.org/news-and-events/beige-book-archive/2013-03-sf,1.0,"Price inflation was limited overall, and upward wage pressures were quite modest",201303,San Francisco,Economy,#92c5de
https://www.minneapolisfed.org/news-and-events/beige-book-archive/2013-03-sf,0.7647058823529411,Price increases were limited for most items,201303,San Francisco,"Employment, Prices, Wages",#92c5de
https://www.minneapolisfed.org/news-and-events/beige-book-archive/2013-03-sf,0.5555555555555556,Reports indicated that credit quality for both business and consumer loans has continued to improve slowly,201303,San Francisco,Finance,#92c5de
https://www.minneapolisfed.org/news-and-events/beige-book-archive/2013-03-sf,0.6,Pharmaceutical goods producers experienced modest gains,201303,San Francisco,"Manufacturing, Services",#92c5de
https://www.minneapolisfed.org/news-and-events/beige-book-archive/2013-03-sf,0.7142857142857143,"Home sales climbed further in most regional markets, and continuing low inventory levels supported stable or increasing prices",201303,San Francisco,"Real Estate, Construction",#92c5de
https://www.minneapolisfed.org/news-and-events/beige-book-archive/2013-03-sf,0.5333333333333333,Retail sales grew modestly on balance,201303,San Francisco,"Retail, Consumer Spending",#92c5de
https://www.minneapolisfed.org/news-and-events/beige-book-archive/2013-03-sl,-1.0,Annual crop production in the District's states declined for most crops in 2012,201303,St. Louis,"Agriculture, Energy, Natural Resources",#f4a582
https://www.minneapolisfed.org/news-and-events/beige-book-archive/2013-03-sl,0.6666666666666666,Economic activity in the Eighth District has expanded at a moderate pace since the previous report,201303,St. Louis,Economy,#92c5de
https://www.minneapolisfed.org/news-and-events/beige-book-archive/2013-03-sl,0.36363636363636365,"Similarly, half of contacts noted that non-labor costs over the past three months have stayed the same, while 48 percent of contacts noted that non-labor costs have increased",201303,St. Louis,"Employment, Prices, Wages",#92c5de
https://www.minneapolisfed.org/news-and-events/beige-book-archive/2013-03-sl,0.3333333333333333,"Credit standards for prime residential mortgage loans remained generally unchanged, while demand ranged from moderately weaker to moderately stronger",201303,St. Louis,Finance,#92c5de
https://www.minneapolisfed.org/news-and-events/beige-book-archive/2013-03-sl,0.2727272727272727,"Several manufacturing firms reported plans to add workers and expand operations in the Eighth District, while fewer manufacturers reported plans to lay off workers or reduce operations",201303,St. Louis,"Manufacturing, Services",#D3D3D3
https://www.minneapolisfed.org/news-and-events/beige-book-archive/2013-03-sl,0.4117647058823529,Commercial and industrial real estate markets improved modestly throughout most of the District,201303,St. Louis,"Real Estate, Construction",#92c5de
https://www.minneapolisfed.org/news-and-events/beige-book-archive/2013-03-sl,0.06666666666666667,Sixty percent of contacts reported increased sales of low-end vehicles relative to high-end vehicles,201303,St. Louis,"Retail, Consumer Spending",#D3D3D3
